{
  "contract-version": "v1",
  "created-at": "2026-03-31T03:38:39.658564Z",
  "criteria": [
    "Review the current project state and call out any gaps."
  ],
  "findings": [],
  "follow-up-actions": [],
  "recommendation": "pass-with-notes",
  "review-id": "rvr_20260331_033839",
  "reviewer": {
    "prompt-id": "prm_20260331_033839",
    "provider-id": "cline",
    "reviewer-key": "cline:cli:unknown",
    "session-id": null,
    "surface": "cli"
  },
  "subject": {
    "adhoc-id": "adh_20260331_033839",
    "kind": "adhoc"
  }
}